name,capacity,recommendedAge,price,bestFor,features,image,images
Spiderman Bouncy House,Up to 8 kids at a time,Ages 4-10,850,"Superhero themes, home parties, photo moments","Large bounce area, hero graphics, safety step, mesh sides",/imgs/rentalItems/img_5.png,"[""/imgs/rentalItems/img_5.png"",""/imgs/rentalItems/img_6.png"",""/imgs/rentalItems/img_7.png""]"
Princess Bouncer,Up to 8 kids at a time,Ages 3-9,850,"Princess themes, birthdays, indoor venues with height clearance","Fairytale graphics, mesh walls, soft entry step",/imgs/rentalItems/img_4.png,"[""/imgs/rentalItems/img_4.png"",""/imgs/rentalItems/img_1.png"",""/imgs/rentalItems/img_3.png""]"
Rock Climber Bouncer,Up to 10 kids at a time,Ages 5-12,1050,"Active kids, school fairs, outdoor lawns","Built-in climb wall, bounce zone, reinforced anchor points",/imgs/rentalItems/img_6.png,"[""/imgs/rentalItems/img_6.png"",""/imgs/rentalItems/img_8.png"",""/imgs/rentalItems/img_9.png""]"
Bouncer + Slide Combo,Up to 10 kids at a time,Ages 4-11,1000,"Higher energy parties, mix of ages, photo-ready setups","Attached slide, basketball hoop, larger bounce zone",/imgs/rentalItems/img_7.png,"[""/imgs/rentalItems/img_7.png"",""/imgs/rentalItems/img_5.png"",""/imgs/rentalItems/img_6.png""]"
Finding Nemo Bouncer,Up to 8 kids at a time,Ages 3-9,850,"Under-the-sea themes, preschool parties, compact spaces","Colorful Nemo artwork, mesh walls, cushioned entry step",/imgs/rentalItems/img_3.png,"[""/imgs/rentalItems/img_3.png"",""/imgs/rentalItems/img_4.png"",""/imgs/rentalItems/img_2.png""]"
Double Side Slide Bouncer,Up to 12 kids at a time,Ages 5-12,1300,"Large guest counts, outdoor setups, back-to-back play","Dual slides, wide bounce area, higher walls for taller kids",/imgs/rentalItems/img_8.png,"[""/imgs/rentalItems/img_8.png"",""/imgs/rentalItems/img_7.png"",""/imgs/rentalItems/img_6.png""]"
